index,url,valid,domain,title,description,image,published,archive,content,quote,language,keyword
https://www.sueddeutsche.de/bayern/un-wetter-bayern-schnee-alpen-regen-ueberschwemmung-unterfranken-li.3316977,https://www.sueddeutsche.de/bayern/un-wetter-bayern-schnee-alpen-regen-ueberschwemmung-unterfranken-li.3316977,0,www.sueddeutsche.de,Wetter in Bayern: Regentief bringt ersten Schnee in den Bergen,Oberhalb von 1800 Metern werden bis zu zehn Zentimeter Neuschnee erwartet. Und auch im restlichen Bayern ist es sehr nass. In Unterfranken drohen sogar Unwetter mit Überschwemmungen.,https://www.sueddeutsche.de/2025/09/24/85181811-7437-4f9a-b667-465167248e9a.jpg?q=60&fm=webp&width=1200&rect=0%2C123%2C1536%2C864,2025-09-24T06:36:06Z,,"Zunächst erwarten die Wetterexperten Dauerregen im nördlichen Schwaben und im westlichen Franken, ab dem Mittag auch in Oberfranken und Teilen der Oberpfalz. In Alpennähe kann es am Nachmittag und Ab… [+804 chars]",,de,'Neuschnee'
https://www.stern.de/panorama/wissen/extremwetterkongress--globale-erwaermung-fuehrt-in-deutschland-zu-mehr-extremwetter-36075770.html,https://www.stern.de/panorama/wissen/extremwetterkongress--globale-erwaermung-fuehrt-in-deutschland-zu-mehr-extremwetter-36075770.html,0,www.stern.de,Extremwetterkongress: Globale Erwärmung führt in Deutschland zu mehr Extremwetter,Auch in Deutschland hat sich der Klimawandel in den vergangenen Jahrzehnten Experten zufolge beschleunigt. Das führe zu mehr Extremwetterereignissen wie Hitzewellen und Sturmfluten.,https://image.stern.de/36075772/t/5R/v1/w1440/r1.7778/-/24--xa456gfa4vv4axs2048jpeg---58b5be0c9efa4190.jpg,2025-09-24T09:18:13Z,,"Kopiere den aktuellen Link
Zur Merkliste hinzufügen
Auch in Deutschland hat sich der Klimawandel in den vergangenen Jahrzehnten Experten zufolge beschleunigt. Das führe zu mehr Extremwetterereignis… [+1354 chars]",,de,'Erwärmung'
https://www.n-tv.de/wissen/Experten-Welt-koennte-sich-bis-2050-um-3-Grad-erwaermen-article26054155.html,https://www.n-tv.de/wissen/Experten-Welt-koennte-sich-bis-2050-um-3-Grad-erwaermen-article26054155.html,0,www.n-tv.de,"""Fliegen aus der Klimakurve"": Experten: Welt könnte sich bis 2050 um 3 Grad erwärmen","Die globale Erwärmung schreitet schneller voran als je zuvor, warnen Experten in Hamburg. Wetterextreme wie Hitzewellen und Sturmfluten nehmen spürbar zu. Besonders alarmierend: Die Nordsee war 2025 so warm wie nie seit Beginn der Messungen.",https://www.n-tv.de/img/incoming/crop26054225/8251325955-cImg_16_9-w1200/548012798.jpg,2025-09-24T12:22:26Z,,"Die globale Erwärmung schreitet schneller voran als je zuvor, warnen Experten in Hamburg. Wetterextreme wie Hitzewellen und Sturmfluten nehmen spürbar zu. Besonders alarmierend: Die Nordsee war 2025 … [+3874 chars]",,de,'Erwärmung'
https://www.stern.de/news/klimaexperten--erderwaermung-um-drei-grad-celsius-bis-2050-moeglich-36077966.html,https://www.stern.de/news/klimaexperten--erderwaermung-um-drei-grad-celsius-bis-2050-moeglich-36077966.html,0,www.stern.de,Klimaexperten: Erderwärmung um drei Grad Celsius bis 2050 möglich,Eine globale Erwärmung um drei Grad Celsius gegenüber dem vorindustriellen Niveau könnte aus Sicht von Experten bereits 2050 erreicht werden. Folglich könnte die zusätzliche Erwärmung in den kommenden 25 Jahren genauso stark ausfallen wie in den vergangenen 1…,https://image.stern.de/36077968/t/76/v1/w1440/r1.7778/-/25--vertrocknete-maispflanzen---24ed7c3d7d0cbb61.jpg,2025-09-24T22:01:54Z,,"Kopiere den aktuellen Link
Zur Merkliste hinzufügen
Eine globale Erwärmung um drei Grad Celsius gegenüber dem vorindustriellen Niveau könnte aus Sicht von Experten bereits 2050 erreicht werden. Fol… [+1869 chars]",,de,'Erwärmung'
https://www.sueddeutsche.de/projekte/artikel/wissen/klimawandel-deutschland-beschleunigung-dpg-extremwetter-e159974/,https://www.sueddeutsche.de/projekte/artikel/wissen/klimawandel-deutschland-beschleunigung-dpg-extremwetter-e159974/,0,www.sueddeutsche.de,Klimawandel: Drei Grad Erwärmung schon bis 2050?,"Physiker und Meteorologen warnen auf großer Bühne davor, dass die Klimakrise eine „Phase der Beschleunigung“ erreicht habe. Was an den Zahlen dran ist – und welche Folgen ein höheres Tempo hätte.","https://www.sueddeutsche.de/projekte/artikel/wissen/klimawandel-deutschland-beschleunigung-dpg-extremwetter-e159974/77857514e55adeff408011f94873a28bdd1ba8da9a8e1c4fdd4240cf8c5dddd7_w2400_h1256_r40,0,2079,1088_q70.png",2025-09-25T11:00:00Z,,"„Warnung vor drohenden weltweiten Klimaänderungen“ ist das Dokument überschrieben. Der Anteil von Kohlendioxid und anderen Spurengasen steige weltweit bedrohlich an, setze sich dieser Trend fort, wür… [+146 chars]",,de,'Erwärmung'
https://www.bild.de/leben-wissen/wissenschaft/erderwaermung-um-3-grad-bis-2050-klima-experte-widerspricht-panikmachern-68d4e5be87648e4c7d77451d,https://www.bild.de/leben-wissen/wissenschaft/erderwaermung-um-3-grad-bis-2050-klima-experte-widerspricht-panikmachern-68d4e5be87648e4c7d77451d,0,www.bild.de,Erderwärmung um 3 Grad bis 2050? - Klima-Experte widerspricht Panikmachern,"Bis 2050 könnte eine globale Erwärmung um drei Grad Celsius erreicht werden, was extremere Wetterereignisse in Deutschland verursacht.","https://images.bild.de/68d4e5be87648e4c7d77451d/f0ffe7ff3e8f535bc093b91cbe83e6e6,ba5ec772?w=1280",2025-09-26T05:45:42Z,,"Um den TTS Player darzustellen, brauchen wir deine Zustimmung. 
 externen Inhalt aktivieren Um eingebettete Inhalte anzuzeigen, ist Ihre jederzeit widerrufliche Einwilligung (über den Schalter oder … [+2064 chars]",,de,'Erwärmung'
https://www.faz.net/aktuell/wissen/wer-zieht-die-notbremse-beim-klimawandel-110704804.html,https://www.faz.net/aktuell/wissen/wer-zieht-die-notbremse-beim-klimawandel-110704804.html,0,www.faz.net,"Expertenpapier zum Klimawandel: Eine Warnung, eine Provokation und manche Spekulation",Wer zieht die Notbremse beim Klimawandel? Die hiesigen Fachverbände der Physiker und Meteorologen stellen eine gefährliche Beschleunigung der Erwärmung fest und stellen Forderungen. Das ist gewagt.,https://media0.faz.net/ppmedia/w1200/aktuell/3886865824/1.10705498/facebook_teaser/wirbelsturm-hoehere.jpg.webp,2025-09-26T12:44:24Z,,"So weit haben sich international noch nicht sehr viele Wissenschaftler und erst recht keine wissenschaftlichen Fachgesellschaften gewagt, so viel Klima-Alarmismus von offizieller Seite ist selten: Bi… [+5173 chars]",,de,'Erwärmung'
https://www.stern.de/news/bericht--invasive-arten-breiten-sich-wegen-erderwaermung-in-weltmeeren-aus-36093334.html,https://www.stern.de/news/bericht--invasive-arten-breiten-sich-wegen-erderwaermung-in-weltmeeren-aus-36093334.html,0,www.stern.de,Bericht: Invasive Arten breiten sich wegen Erderwärmung in Weltmeeren aus,"Die Erwärmung der Weltmeere führt laut einem neuen Bericht zur Ausbreitung invasiver Arten und hat Auswirkungen auf die Artenvielfalt und die Fischerei. Besonders betroffen ist das Mittelmeer, wie das europäische Erdbeobachtungsprogramm Copernicus in seinem a…",https://image.stern.de/36093336/t/yN/v1/w1440/r1.7778/-/30--blaue-krabbe---6f5bb18869b464b0.jpg,2025-09-30T10:11:39Z,,"Kopiere den aktuellen Link
Zur Merkliste hinzufügen
Die Erwärmung der Weltmeere führt laut einem neuen Bericht zur Ausbreitung invasiver Arten und hat Auswirkungen auf die Artenvielfalt und die Fis… [+1940 chars]",,de,'Erwärmung'
