index,published,keyword,domain,language,valid,title,description,url,image,archive,content,quote,de,en,la,added
18ee20ef0575144239eeef06d74481ae,2026-03-01T12:43:00Z,'Lawine',www.zeit.de,de,0.9,Berchtesgadener Alpen: Schneeschuhwanderer lösen Lawine aus und werden verschüttet,Hier finden Sie Informationen zu dem Thema „Berchtesgadener Alpen“. Lesen Sie jetzt „Schneeschuhwanderer lösen Lawine aus und werden verschüttet“.,https://www.zeit.de/news/2026-03/01/schneeschuhwanderer-loesen-lawine-aus-und-werden-verschuettet,https://img.zeit.de/news/2026-03/01/schneeschuhwanderer-loesen-lawine-aus-und-werden-verschuettet-image-group/wide__1300x731,http://web.archive.org/web/20260301130419/https://www.zeit.de/news/2026-03/01/schneeschuhwanderer-loesen-lawine-aus-und-werden-verschuettet,Schneeschuhwanderer haben in den Berchtesgadener Alpen eine Lawine ausgelöst und sind davon mitgerissen worden. Laut Polizei wurde nur einer von ihnen leicht verletzt. Die Gruppe sei ohne alpine Erfa… [+1197 chars],,Berchtesgadener Alpen: Schneeschuhwanderer lösen Lawine aus und werden verschüttet. Hier finden Sie Informationen zu dem Thema „Berchtesgadener Alpen“. Lesen Sie jetzt „Schneeschuhwanderer lösen Lawine aus und werden verschüttet“.,Berchtesgaden Alps: Snowshoe hikers trigger an avalanche and are buried. Here you will find information on the topic “Berchtesgaden Alps”. Now read “Snowshoers trigger an avalanche and are buried”.,"Alpes Berchtesgaden: Snowshoe hikers felis avalanche et asservatur. Hic informationes invenies in themate ""Berchtesgaden Alpes"". Nunc lege ""Nives NIVIS CAELI ac sepeliuntur"".",2026-03-03 09:06:23+00:00
7a265089a273ef9fb842f536a9fbd384,2026-03-01T12:43:00Z,'Lawine',www.stern.de,de,0.9,Berchtesgadener Alpen: Schneeschuhwanderer lösen Lawine aus und werden verschüttet,"Ohne alpine Erfahrung und Schutzausrüstung unterwegs: Eine Gruppe Schneeschuhwanderer löst eine Lawine aus und wird mitgerissen. Die Polizei spricht von ""Glück"" für die Beteiligten.",https://www.stern.de/gesellschaft/regional/bayern/berchtesgadener-alpen--schneeschuhwanderer-loesen-lawine-aus-und-werden-verschuettet-37181152.html,https://image.stern.de/37181154/t/ae/v1/w1440/r1.7778/-/01--rgm6ovrqulv15axs2048jpeg---8d08b3b8f3972c6e.jpg,,"Kopiere den aktuellen Link
Zur Merkliste hinzufügen
Ohne alpine Erfahrung und Schutzausrüstung unterwegs: Eine Gruppe Schneeschuhwanderer löst eine Lawine aus und wird mitgerissen. Die Polizei spri… [+1394 chars]",,"Berchtesgadener Alpen: Schneeschuhwanderer lösen Lawine aus und werden verschüttet. Ohne alpine Erfahrung und Schutzausrüstung unterwegs: Eine Gruppe Schneeschuhwanderer löst eine Lawine aus und wird mitgerissen. Die Polizei spricht von ""Glück"" für die Beteiligten.",Berchtesgaden Alps: Snowshoe hikers trigger an avalanche and are buried. On the move without alpine experience or protective equipment: a group of snowshoe hikers trigger an avalanche and are swept away. The police speak of “luck” for those involved.,"Alpes Berchtesgaden: Snowshoe hikers felis avalanche et asservatur. In motu sine experientia alpina vel armorum tutela: globus nivis hikers felis NIVIS et rapitur. Magistratus loquuntur de ""fortuna"" pro illis qui intersunt.",2026-03-03 09:06:23+00:00
043206ccff7b2a3c06c7bd01f79292c7,2026-03-01T17:36:33Z,'Lawinenkegel',www.diepresse.com,de,0.9,Zwei Skitourengeher bei Lawinenabgang in Tirol ums Leben gekommen,Die Leichen der beiden Einheimischen wurden am Sonntag im Rahmen einer groß angelegten Suchaktion in einem Lawinenkegel in den Tuxer Alpen gefunden.,https://www.diepresse.com/20638305/zwei-skitourengeher-bei-lawinenabgang-in-tirol-ums-leben-gekommen,https://img.diepresse.com/public/incoming/g5qiqw-kein-titel/alternates/DPR_SOCIAL_NACHRICHTEN/kein%20Titel,,"Die Leichen der beiden Einheimischen wurden am Sonntag im Rahmen einer groß angelegten Suchaktion in einem Lawinenkegel in den Tuxer Alpen gefunden.
Zwei Skitourengeher im Alter von 44 und 47 Jahren… [+1618 chars]",,Zwei Skitourengeher bei Lawinenabgang in Tirol ums Leben gekommen. Die Leichen der beiden Einheimischen wurden am Sonntag im Rahmen einer groß angelegten Suchaktion in einem Lawinenkegel in den Tuxer Alpen gefunden.,Two ski tourers died in an avalanche in Tyrol. The bodies of the two locals were found on Sunday as part of a large-scale search operation in an avalanche cone in the Tux Alps.,Duae ski Tourers in monte Raetici mortuus est. Corpora duorum incolis die Dominico inventa sunt ut pars operationis magnae inquisitionis in cono NIVIS in Alpibus Tux.,2026-03-08 20:47:49+00:00
c0e116ba96cef812348d3972a91eff68,2026-03-09T15:24:46Z,'Lawine',www.zeit.de,de,0.9,Österreich: Deutscher Schneeschuh-Wanderer in Tirol von Lawine getötet,Hier finden Sie Informationen zu dem Thema „Österreich“. Lesen Sie jetzt „Deutscher Schneeschuh-Wanderer in Tirol von Lawine getötet“.,https://www.zeit.de/news/2026-03/09/deutscher-schneeschuh-wanderer-in-tirol-von-lawine-getoetet,https://img.zeit.de/news/2026-03/09/deutscher-schneeschuh-wanderer-in-tirol-von-lawine-getoetet-image-group/wide__1300x731,,Ein Wintersportler aus dem Raum Stuttgart ist in den Tiroler Bergen Hunderte Meter von einer Lawine mitgerissen und getötet worden. Das teilte die österreichische Polizei am Montag mit. Demnach alarm… [+899 chars],,Österreich: Deutscher Schneeschuh-Wanderer in Tirol von Lawine getötet. Hier finden Sie Informationen zu dem Thema „Österreich“. Lesen Sie jetzt „Deutscher Schneeschuh-Wanderer in Tirol von Lawine getötet“.,Austria: German snowshoe hiker killed by avalanche in Tyrol. Here you will find information on the topic of “Austria”. Now read “German snowshoe hiker killed by avalanche in Tyrol”.,"Austria: German snowshoe hiker occisus ab Avalanche in Tyrol. Hic informationes invenies in argumento ""Austriae"". Nunc legitur ""Germanicus snowshoe hiker occisus ab NIVIS in Tyrol"".",2026-03-11 15:11:23+00:00
