index,url,valid,domain,title,description,image,published,archive,content,quote,language,keyword
https://www.stern.de/news/klimaexperten--erderwaermung-um-drei-grad-celsius-bis-2050-moeglich-36077966.html,https://www.stern.de/news/klimaexperten--erderwaermung-um-drei-grad-celsius-bis-2050-moeglich-36077966.html,0,www.stern.de,Klimaexperten: Erderwärmung um drei Grad Celsius bis 2050 möglich,Eine globale Erwärmung um drei Grad Celsius gegenüber dem vorindustriellen Niveau könnte aus Sicht von Experten bereits 2050 erreicht werden. Folglich könnte die zusätzliche Erwärmung in den kommenden 25 Jahren genauso stark ausfallen wie in den vergangenen 1…,https://image.stern.de/36077968/t/76/v1/w1440/r1.7778/-/25--vertrocknete-maispflanzen---24ed7c3d7d0cbb61.jpg,2025-09-24T22:01:54Z,,"Kopiere den aktuellen Link
Zur Merkliste hinzufügen
Eine globale Erwärmung um drei Grad Celsius gegenüber dem vorindustriellen Niveau könnte aus Sicht von Experten bereits 2050 erreicht werden. Fol… [+1869 chars]",,de,'Erwärmung'
https://www.stern.de/news/bericht--invasive-arten-breiten-sich-wegen-erderwaermung-in-weltmeeren-aus-36093334.html,https://www.stern.de/news/bericht--invasive-arten-breiten-sich-wegen-erderwaermung-in-weltmeeren-aus-36093334.html,0,www.stern.de,Bericht: Invasive Arten breiten sich wegen Erderwärmung in Weltmeeren aus,"Die Erwärmung der Weltmeere führt laut einem neuen Bericht zur Ausbreitung invasiver Arten und hat Auswirkungen auf die Artenvielfalt und die Fischerei. Besonders betroffen ist das Mittelmeer, wie das europäische Erdbeobachtungsprogramm Copernicus in seinem a…",https://image.stern.de/36093336/t/yN/v1/w1440/r1.7778/-/30--blaue-krabbe---6f5bb18869b464b0.jpg,2025-09-30T10:11:39Z,,"Kopiere den aktuellen Link
Zur Merkliste hinzufügen
Die Erwärmung der Weltmeere führt laut einem neuen Bericht zur Ausbreitung invasiver Arten und hat Auswirkungen auf die Artenvielfalt und die Fis… [+1940 chars]",,de,'Erwärmung'
