index,published,keyword,domain,language,valid,title,description,url,image,archive,content,quote,de,en,la,added,locations,country,ipcc,continent,latitude,longitude
59326a5a0aaff44b642d7a8ea3da1fda,2026-07-03T12:44:50Z,'Lawinenverbauung',tirol.orf.at,de,0.9,Neustift: Millionen für den Hochwasserschutz,"Die Wildbach- und Lawinenverbauung hat für die Gemeinde Neustift im Stubaital (Bezirk Innsbruck-Land) ein umfassendes Schutzprojekt ausgearbeitet, das am Freitag präsentiert wurde. In Summe werden fast 25 Millionen Euro investiert, um den Ortsteil Milders nac…",https://tirol.orf.at/stories/3361140/,https://ibs.orf.at/tir?image=https%3A%2F%2Foekastatic.orf.at%2Fmims%2F2026%2F27%2F85%2Fcrops%2Fw%3D1200%2Ch%3D627%2Cq%3D75%2F3099647_master_1200485_52191c79-1960-4b5d-b140-ddf33b43018f.jpg%3Fs%3D57dcd55ee2b293fcb6a83d4dfa16faa4ad2dd571,http://web.archive.org/web/20260703234508/https://tirol.orf.at/stories/3361140/,Allein in den vergangenen zwölf Jahren kam es am Oberbergbach in der Gemeinde Neustift zu sechs größeren Hochwasserereignissen. Um den Ortsteil Milders mit rund 800 Einwohnerinnen und Einwohnern zu s… [+2412 chars],,"Neustift: Millionen für den Hochwasserschutz. Die Wildbach- und Lawinenverbauung hat für die Gemeinde Neustift im Stubaital (Bezirk Innsbruck-Land) ein umfassendes Schutzprojekt ausgearbeitet, das am Freitag präsentiert wurde. In Summe werden fast 25 Millionen Euro investiert, um den Ortsteil Milders nac…","Neustift: Millions for flood protection. The torrent and avalanche control department has developed a comprehensive protection project for the municipality of Neustift in the Stubaital (Innsbruck-Land district), which was presented on Friday. A total of almost 25 million euros will be invested in redeveloping the Milders district...","Neustift: Inundatio pro Ingentis praesidii. Torrens et NIVIS ditionis department evolvit tutelam comprehensivam ad municipium Neustift in Stubaital ( districtus Innsbruck-Land ) , qui Veneris die praesentatus est. Nummi fere XXV miliones nummi in redevelopatione Milders agri collocabuntur...",2026-07-07 21:51:52+00:00,,,,,,
b2d14c05250cf3c94f08432068e7eaf9,2026-07-17T05:27:20Z,'Lawine',www.diepresse.com,de,0.9,Lawine aus Geröll: Mehrere Menschen in Westchina verschüttet,Östlich der Metropole Chongqing sollen mehrere Wohnhäuser verschüttet und Menschen eingeschlossen sein.,https://www.diepresse.com/37947830/lawine-aus-geroell-mehrere-menschen-in-westchina-verschuettet,https://www.diepresse.com/assets_v2/images/diepresse_nachrichten.png,,"Die Presse auf Google als bevorzugte Nachrichtenquelle hinzufügen.
 Mehrere Menschen sind im Westen Chinas bei einem Erdrutsch verschüttet worden. Wie der Katastrophenschutz mitteilte, kam es am Vor… [+957 chars]",,Lawine aus Geröll: Mehrere Menschen in Westchina verschüttet. Östlich der Metropole Chongqing sollen mehrere Wohnhäuser verschüttet und Menschen eingeschlossen sein.,"Debris avalanche: Several people buried in western China. To the east of the metropolis of Chongqing, several residential buildings are said to be buried and people trapped.","Strages NIVIS: Plures homines in Sinis occidentalibus sepulti sunt. Ad orientem metropolis Chongqing, plura aedificia residentiales dicuntur sepeliri et capti homines.",2026-07-19 06:12:44+00:00,,,,,,
5e6223fee9df1daa6a58d8dbf2551854,2026-07-10T17:38:13Z,'Lawine',www.faz.net,de,0.9,"Trump, Infantino und das IOC: Das Spiel hinter dem Spiel",Die Lawine kommt gerade erst in Bewegung: Bei den Olympischen Spielen dürfte das Problem der politischen Einflussnahme noch größer werden als bei der Fußball-WM. Das IOC liefert die perfekte Steilvorlage.,https://www.faz.net/aktuell/sport/fussball-wm/fussball-wm-2026-in-den-usa-unter-trump-doppelpass-mit-der-doppelmoral-201011134.html,https://media0.faz.net/image/w1200h627/e3c088165892/w8256h4313x0y534o/202606/43601.0.2253916934/ziehen-die-grossen-faeden.webp,http://web.archive.org/web/20260712072536/https://www.faz.net/aktuell/sport/fussball-wm/fussball-wm-2026-in-den-usa-unter-trump-doppelpass-mit-der-doppelmoral-201011134.html,Donald Trump und Gianni Infantino haben telefoniert. Dabei ist etwas ins Rutschen gekommen. Was entwickelt sich bei dieser Fußball-Weltmeisterschaft mitten im Sommer? Ein Schneebrett oder doch eine L… [+2884 chars],,"Trump, Infantino und das IOC: Das Spiel hinter dem Spiel. Die Lawine kommt gerade erst in Bewegung: Bei den Olympischen Spielen dürfte das Problem der politischen Einflussnahme noch größer werden als bei der Fußball-WM. Das IOC liefert die perfekte Steilvorlage.","Trump, Infantino and the IOC: The game behind the game. The avalanche is only just beginning to move: the problem of political influence is likely to be even greater at the Olympic Games than at the World Cup. The IOC provides the perfect pitch.","Trump, Infantino and IOC: Ludus post ludum. NIVIS CASUS tantum movere incipit: problema politicae auctoritatis etiam maius in Olympiadibus quam in Trophaeo Mundi futurum esse verisimile est. IOC perfectam picem praebet.",2026-07-20 16:08:05+00:00,,,,,,
92feb0010961e2f862307a3993ae2cfa,2026-07-11T09:06:37Z,'Lawine',www.zeit.de,de,0.9,54 Jahre: Mit 54 kehrt die Zufriedenheit zurück,In unserer Kolumne nehmen wir uns jede Woche Fakten eines Lebensjahres vor. In diesem überlebte ein Italiener 20 Stunden unter einer Lawine.,https://www.zeit.de/2026/30/54-jahre-fruehrente-arbeitsmarkt-metallindustrie,https://img.zeit.de/2026/30/mit-bild-1/wide__1300x731,http://web.archive.org/web/20260712035259/https://www.zeit.de/2026/30/54-jahre-fruehrente-arbeitsmarkt-metallindustrie,"Dieser Artikel ist Teil von ZEIT am Wochenende, Ausgabe 28/2026. 
Mit 54 gewann Jürgen Klopp 2022 als erster deutscher Fußballtrainer mit dem FC Liverpool den FA Cup, den ältesten Pokalwettbewerb de… [+559 chars]",,54 Jahre: Mit 54 kehrt die Zufriedenheit zurück. In unserer Kolumne nehmen wir uns jede Woche Fakten eines Lebensjahres vor. In diesem überlebte ein Italiener 20 Stunden unter einer Lawine.,"54 years: At 54, satisfaction returns. Every week in our column we look at facts from a year of life. In this one, an Italian survived under an avalanche for 20 hours.","LIV annis: In LIIII, redit satisfactio. Singulis septimanis in columna nostra res ab anno vitae spectamus. Hoc unum Italus sub NIVIS XX horis supervixit.",2026-07-20 16:08:05+00:00,,,,,,
d03ae8b8f13780ad0037a999d42aa073,2026-07-14T09:13:41Z,'Lawine',www.faz.net,de,0.9,Fußball-Jugendförderung: Die Eintracht und das Warten auf die Talent-Lawine,"Wie in Deutschland, so in Frankfurt: Die Eintracht bildet zu wenige Toptalente aus. Deshalb hat der hessische Bundesligaklub in der Jugendarbeit einiges umgestellt. Wann trägt das Früchte?",https://www.faz.net/aktuell/sport/rhein-main-sport/eintracht-frankfurt/eintracht-frankfurt-so-soll-sich-die-talentfoerderung-verbessern-accg-201022446.html,https://media0.faz.net/image/w1200h627/d31db6b11505/w9000h4702x0y413o/202607/43601.0.2324599876/exporterfolg-nacho-ferri-der.webp,,"Die Frankfurter Eintracht vollzieht in diesem Sommer einen sportlichen Umbruch in außergewöhnlicher Heftigkeit. Sportvorstand Markus Krösche verzog vor den Sommerferien belustigt die Mundwinkel, als … [+205 chars]",,"Fußball-Jugendförderung: Die Eintracht und das Warten auf die Talent-Lawine. Wie in Deutschland, so in Frankfurt: Die Eintracht bildet zu wenige Toptalente aus. Deshalb hat der hessische Bundesligaklub in der Jugendarbeit einiges umgestellt. Wann trägt das Früchte?","Football youth development: unity and waiting for the talent avalanche. As in Germany, so in Frankfurt: Eintracht trains too few top talents. That's why the Hessian Bundesliga club has made some changes in youth work. When will this bear fruit?","Eu adolescens progressionem: unitas et expectans ingenium NIVIS. Ut in Germania, ita in Frankfurt: Eintracht docta nimis pauca summa talenta. Quam ob rem Hessian Bundesliga clava aliquas mutationes in opere iuventutis fecit. Quando hic fructum feret?",2026-07-20 16:08:05+00:00,,,,,,
