index,published,keyword,domain,language,valid,title,description,url,image,archive,content,quote,de,en,la,added
5319c9f6144de61720628282dd682de5,2026-03-01T15:03:16Z,'Lawinenkegel',tirol.orf.at,de,0.9,Zwei Tote bei Lawinenabgang,"In den Tuxer Alpen sind am Samstag zwei Skitourengeher bei einem Lawinenabgang tödlich verletzt worden. Nachdem sie nicht nach Hause zurückgekehrt waren, startete bereits am Samstag ein Sucheinsatz, der am Sonntag fortgeführt wurde.",https://tirol.orf.at/stories/3343949/,https://ibs.orf.at/tir?image=https%3A%2F%2Foekastatic.orf.at%2Fmims%2F2020%2F27%2F12%2Fcrops%2Fw%3D1200%2Ch%3D627%2Cq%3D75%2F608525_master_208412_polizei_libelle_tirol.jpg%3Fs%3D9b9f0086086af06dd08981be1d83c551f935edb1,,"Angehörige meldeten die beiden Tourengeher als vermisst, nachdem sie am Samstag nicht von einer Skitour in den Tuxer Alpen zurückgekehrt waren. Die Einsatzkräfte begannen noch Samstagabend mit der Su… [+642 chars]",,"Zwei Tote bei Lawinenabgang. In den Tuxer Alpen sind am Samstag zwei Skitourengeher bei einem Lawinenabgang tödlich verletzt worden. Nachdem sie nicht nach Hause zurückgekehrt waren, startete bereits am Samstag ein Sucheinsatz, der am Sonntag fortgeführt wurde.","Two dead in avalanche. Two ski tourers were fatally injured in an avalanche in the Tux Alps on Saturday. After they failed to return home, a search operation began on Saturday and continued on Sunday.","Duo mortui in NIVIS. Duo ski Tourers in montem cadentem in montem Tux Alpium die Sabbati laesi sunt. Postquam domum redire nequiverunt, operatio inquisitionis die Sabbati incepit et die Dominico continuavit.",2026-03-19 15:10:38+00:00
39c63b2d464137d7f11ed7269049d41d,2026-03-01T07:30:02Z,'Lawine',salzburg.orf.at,de,0.9,Schneeschuwanderer überleben Lawinenunfall,"Drei Schneeschuhwanderer haben Samstag einen Lawinenunfall in den Berchtesgadener Alpen überlebt. Das Schneebrett ging beim Windschartenkopf ab – am Westrand des Hagengebirges hoch über dem Königssee, direkt an der Staatsgrenze zum Salzburger Tennengau.",https://salzburg.orf.at/stories/3343897/,https://ibs.orf.at/sbg?image=https%3A%2F%2Foekastatic.orf.at%2Fmojo%2F1_4_1%2Fstoryserver%2Foeka%2Fcommon%2Fimages%2Fog-fallback-sbg.png%3Fs%3Dc92708ae469bc368ecb4861244504a18cb7e05fa,,"Alle Verschütteten konnten sich laut Einsatzkräften selbst aus den Schneemassen befreien. Eine Person wurde leicht verletzt. Von der Polizei heißt es dazu, die Gruppe habe großes Glück gehabt.
Die S… [+164 chars]",,"Schneeschuwanderer überleben Lawinenunfall. Drei Schneeschuhwanderer haben Samstag einen Lawinenunfall in den Berchtesgadener Alpen überlebt. Das Schneebrett ging beim Windschartenkopf ab – am Westrand des Hagengebirges hoch über dem Königssee, direkt an der Staatsgrenze zum Salzburger Tennengau.","Snowshoers survive avalanche accident. Three snowshoers survived an avalanche accident in the Berchtesgaden Alps on Saturday. The snow slab came off at Windschartenkopf - on the western edge of the Hagengebirge high above Königssee, right on the state border with Salzburg's Tennengau.","Snowshoers casus superstes NIVIS. Tres snowshoers casus cadentis in Berchtesgaden Alpes Saturni die superfuerunt. Tabula nivis discessit ad Windschartenkopf - in occidentali ripa Hagengebirge supra Königssee alta, dextra in confinio civitatis Tennengau Salzburgae.",2026-03-20 05:01:44+00:00
1daf9c31be7df2417fd0f3c1000ac685,2026-03-01T10:14:32Z,'Schneemassen',www.bild.de,de,0.7,Kaum noch zu erkennen - Skifahrer von Schneewehe verschluckt,In Kalifornien haben zwei Skifahrer jetzt einem Mann das Leben gerettet. Er war offenbar gestürzt und von den weichen Schneemassen verschüttet worden.,https://www.bild.de/news/ausland/kaum-noch-zu-erkennen-skifahrer-von-schneewehe-verschluckt-69a03dadc92c2b23b025c9b2,"https://images.bild.de/69a03dadc92c2b23b025c9b2/9c2802c293ac18d73b70cfb31436ef06,63d9d3c?w=1280",,"+++Angriff auf Iran Keine Flüge in den Nahen Osten von Berlin
+++Angriff auf Iran Keine Flüge in den Nahen Osten von Berlin
+++Angriff auf Iran Keine Flüge in den Nahen Osten von Berlin
+++Angriff… [+428 chars]",,Kaum noch zu erkennen - Skifahrer von Schneewehe verschluckt. In Kalifornien haben zwei Skifahrer jetzt einem Mann das Leben gerettet. Er war offenbar gestürzt und von den weichen Schneemassen verschüttet worden.,Barely visible - skier swallowed by snowdrift. Two skiers have now saved a man's life in California. He had apparently fallen and been buried in the soft masses of snow.,Vix conspicuus - skier nivis devoratus est. Duo nautae nunc in California vitam hominis servaverunt. Videtur cecidisse et obrutus in molli nivis.,2026-03-20 05:01:44+00:00
d5f87ab60169e9dccd3a94e69f03b81a,2026-03-16T10:49:17Z,'Lawine',www.tagesschau.de,de,0.9,Tod am Berg: Ungewöhnlich viele Lawinenopfer in diesem Winter,Seit Oktober sind 126 Menschen durch Lawinen in europäischen Gebirgen ums Leben gekommen - soviele wie seit Langem nicht mehr. Eine Region in den Alpen ist besonders betroffen.,https://www.tagesschau.de/ausland/europa/lawinen-europa-alpen-100.html,https://images.tagesschau.de/image/4aa66b9c-781a-4837-bb3c-5e605ea51fbb/AAABnPYkLk4/AAABmyZE0EA/16x9-big/lawinengefahr-104.jpg?width=1280,,"Stand: 16.03.2026 11:49 Uhr
Seit Oktober sind 126 Menschen durch Lawinen in europäischen Gebirgen ums Leben gekommen - soviele wie seit Langem nicht mehr. Eine Region in den Alpen ist besonders betr… [+1455 chars]",,Tod am Berg: Ungewöhnlich viele Lawinenopfer in diesem Winter. Seit Oktober sind 126 Menschen durch Lawinen in europäischen Gebirgen ums Leben gekommen - soviele wie seit Langem nicht mehr. Eine Region in den Alpen ist besonders betroffen.,"Death on the mountain: An unusually high number of avalanche victims this winter. Since October, 126 people have died in avalanches in European mountains - more than in a long time. One region in the Alps is particularly affected.",Mors in monte: Inusitatae altitudinis numerus NIVIS victimarum hac hieme. Ab Octobre 126 homines in avalanches in montibus Europaeis mortui sunt - plusquam diu. Una regio in Alpibus praecipua est.,2026-03-20 09:04:52+00:00
daccc200793b6b1d991a5e790c9f86c9,2026-03-14T04:55:00Z,'Regen auf Schneedecke',www.diepresse.com,de,0.9,Lawinengefahr nicht gebannt: Das Problem heißt Altschnee [premium],Der Schneemangel soll Skitourengeher in dieser Saison nicht in Sicherheit wiegen. Besonders heimtückisch ist die schwache Altschneeschicht. Was bei Frühjahrstouren sonst noch anfällt.,https://www.diepresse.com/20676071/lawinengefahr-nicht-gebannt-das-problem-heisst-altschnee,https://img.diepresse.com/public/incoming/7xlecf-pxl20260303111922137jpg/alternates/DPR_SOCIAL_MAGAZIN/PXL_20260303_111922137.jpg,,"Beim frühen Frühstückskaffee über die Landkarte (Maßstab 1:25:000) gebeugt, mutet die Skitour im Hinteren Passeiertal (Südtirol) noch abstrakt an. Es ist nicht einfach für Laien, zweidimensionale Gel… [+3493 chars]",,Lawinengefahr nicht gebannt: Das Problem heißt Altschnee [premium]. Der Schneemangel soll Skitourengeher in dieser Saison nicht in Sicherheit wiegen. Besonders heimtückisch ist die schwache Altschneeschicht. Was bei Frühjahrstouren sonst noch anfällt.,Danger of avalanches not averted: The problem is old snow [premium]. The lack of snow should not lull ski tourers into safety this season. The weak layer of old snow is particularly insidious. What else happens on spring tours?,Periculum avalanches non avertitur: Quaestio est nix vetus. Defectus nivis ski touratores sopire non debet in hoc tempore salutem. Iacuit veteris nivis imprimis insidiosum. Quid aliud fit in verna Turonensis?,2026-03-23 21:01:08+00:00
1562fe0be0563262879835f986f592eb,2026-03-17T12:33:23Z,'Lawine',www.nzz.ch,de,0.9,Traurige Bilanz: Im Winter 2025/26 kamen in Europa ungewöhnlich viele Menschen bei Lawinen ums Leben,In diesem Winter sind bereits mindestens 127 Menschen in Lawinen gestorben – deutlich mehr als im langjährigen Durchschnitt. Fachleute sehen dafür sowohl klimatische Veränderungen als auch riskanteres Verhalten als Gründe.,https://www.nzz.ch/panorama/traurige-bilanz-im-winter-202526-kamen-in-europa-ungewoehnlich-viele-menschen-bei-lawinen-ums-leben-ld.1929618,"https://img.nzz.ch/2026/03/17/dd189331-6175-4a95-908c-5c0b7cf7eb79.jpg?width=1200&height=675&fit=bounds&quality=75&auto=webp&crop=5568,3132,x0,y290&wmark=nzz",http://web.archive.org/web/20260318034043/https://www.nzz.ch/panorama/traurige-bilanz-im-winter-202526-kamen-in-europa-ungewoehnlich-viele-menschen-bei-lawinen-ums-leben-ld.1929618,In diesem Winter sind bereits mindestens 127 Menschen in Lawinen gestorben deutlich mehr als im langjährigen Durchschnitt. Fachleute sehen dafür sowohl klimatische Veränderungen als auch riskanteres … [+3881 chars],,Traurige Bilanz: Im Winter 2025/26 kamen in Europa ungewöhnlich viele Menschen bei Lawinen ums Leben. In diesem Winter sind bereits mindestens 127 Menschen in Lawinen gestorben – deutlich mehr als im langjährigen Durchschnitt. Fachleute sehen dafür sowohl klimatische Veränderungen als auch riskanteres Verhalten als Gründe.,"Sad results: In the winter of 2025/26, an unusually large number of people died in avalanches in Europe. At least 127 people have died in avalanches this winter - significantly more than the long-term average. Experts see both climatic changes and riskier behavior as reasons for this.","Tristes eventus: Hieme 2025/26, maior numerus hominum in avalanches in Europa mortuus est. Saltem 127 homines in avalanches hac hieme mortui sunt, signanter plus quam mediocris tempus. Periti tum mutationes climaticas et periculosiores mores huius rei rationes videre.",2026-03-24 05:10:20+00:00
3b96254b780416d9e595099f1b2492d1,2026-03-21T14:44:02Z,'Lawine',www.stern.de,de,0.9,Alpen: Lawine in Südtirol: Mehrere Skifahrer verschüttet,Bozen - In Südtirol sind mehrere Skifahrer von einer großen Lawine erfasst worden. Nach Angaben der italienischen Bergwacht löste sich die Lawine in,https://www.stern.de/panorama/alpen--lawine-in-suedtirol--mehrere-skifahrer-verschuettet-37242652.html,https://image.stern.de/37242654/t/Hb/v1/w1440/r1.7778/-/21--f2qlko3wavv6axs2048jpeg---fa23d95d96496879.jpg,,"Kopiere den aktuellen Link
Zur Merkliste hinzufügen
In den italienischen Alpen geht eine Lawine nieder. Die Rettungsdienste sind im Großeinsatz. Noch ist nicht klar, ob es Opfer gibt.
In Südtirol … [+1719 chars]",,Alpen: Lawine in Südtirol: Mehrere Skifahrer verschüttet. Bozen - In Südtirol sind mehrere Skifahrer von einer großen Lawine erfasst worden. Nach Angaben der italienischen Bergwacht löste sich die Lawine in,"Alps: Avalanche in South Tyrol: Several skiers buried. Bolzano - In South Tyrol, several skiers were hit by a large avalanche. According to the Italian mountain rescue service, the avalanche occurred in","Alpes: Avalanche in Tyrolis australis: complures nautae sepeliuntur. Bolzano - In Tyrolis Australi complures nautae magno NIVIS CASUS sunt percussi. Iuxta servitutem liberandum montem Italiae, NIVIS incidit in",2026-03-24 05:10:20+00:00
1e83bb09685353cb2fff769045fe0b2d,2026-03-21T14:44:02Z,'Lawine',www.zeit.de,de,0.9,Alpen: Lawine in Südtirol: Mehrere Skifahrer verschüttet,Hier finden Sie Informationen zu dem Thema „Alpen“. Lesen Sie jetzt „Lawine in Südtirol: Mehrere Skifahrer verschüttet“.,https://www.zeit.de/news/2026-03/21/lawine-in-suedtirol-mehrere-skifahrer-verschuettet,https://img.zeit.de/news/2026-03/21/lawine-in-suedtirol-mehrere-skifahrer-verschuettet-image-group/wide__1300x731,http://web.archive.org/web/20260322040621/https://www.zeit.de/news/2026-03/21/lawine-in-suedtirol-mehrere-skifahrer-verschuettet,In Südtirol sind mehrere Skifahrer von einer großen Lawine erfasst worden. Nach Angaben der italienischen Bergwacht löste sich die Lawine in hochalpinem Gelände an der mehr als 2.600 Meter hohen Hohe… [+1572 chars],,Alpen: Lawine in Südtirol: Mehrere Skifahrer verschüttet. Hier finden Sie Informationen zu dem Thema „Alpen“. Lesen Sie jetzt „Lawine in Südtirol: Mehrere Skifahrer verschüttet“.,Alps: Avalanche in South Tyrol: Several skiers buried. Here you will find information on the topic of “Alps”. Now read “Avalanche in South Tyrol: Several skiers buried”.,"Alpes: Avalanche in Tyrolis australis: complures nautae sepeliuntur. Hic informationes invenies in argumento ""Alpis"". Nunc legitur ""Avalanche in South Tyrol: complures skiers sepultus est"".",2026-03-24 05:10:20+00:00
99d1afb6f07d628938fa9c9ada46249e,2026-03-21T14:45:15Z,'Lawine Klimawandel',www.tagesspiegel.de,de,0.9,Mehr als 60 Helfer im Einsatz: Lawine verschüttet Skifahrer in Südtirol – mindestens zwei Tote,Schon wieder ein Lawinenunglück in den italienischen Alpen: An der Hohen Ferse reißen die Schneemassen mehrere Skifahrer mit. Fünf Menschen werden verletzt.,https://www.tagesspiegel.de/gesellschaft/panorama/mehr-als-60-helfer-im-einsatz-lawine-verschuttet-skifahrer-in-sudtirol--mindestens-zwei-tote-15385775.html,https://www.tagesspiegel.de/images/15385809/alternates/BASE_16_9_W1400/1774107151000/lawinenungluck-in-sudtirol.jpeg,,Bei einem Lawinenunglück in Südtirol sind mindestens zwei Skifahrer ums Leben gekommen. Nach Angaben der italienischen Bergwacht wurden gegen Mittag etwa zwei Dutzend Tourengeher an der 2.669 Meter h… [+2847 chars],,Mehr als 60 Helfer im Einsatz: Lawine verschüttet Skifahrer in Südtirol – mindestens zwei Tote. Schon wieder ein Lawinenunglück in den italienischen Alpen: An der Hohen Ferse reißen die Schneemassen mehrere Skifahrer mit. Fünf Menschen werden verletzt.,More than 60 helpers on duty: avalanche buries skiers in South Tyrol - at least two dead. Another avalanche disaster in the Italian Alps: the masses of snow swept away several skiers on the Hohe Ferse. Five people are injured.,Plus quam 60 adiutores in officio sunt: ​​NIVIS sepelit nautas in Tyrolis Australi - saltem duos mortuos. Alia NIVIS CASUS in Alpibus Italicis: massae nivis complures nautas in Hohe Ferse rapuerunt. Quinque homines laeduntur.,2026-03-24 05:10:20+00:00
54c1e57ce2f3cd5af0418d54f03454c9,2026-03-21T14:45:15Z,'Lawine Klimawandel',www.tagesspiegel.de,de,0.9,Alpen: Lawine in Südtirol: Mehrere Skifahrer verschüttet,"In den italienischen Alpen geht eine Lawine nieder. Die Rettungsdienste sind im Großeinsatz. Noch ist nicht klar, ob es Opfer gibt.",https://www.tagesspiegel.de/gesellschaft/panorama/alpen-lawine-in-sudtirol-mehrere-skifahrer-verschuttet-15385775.html,https://www.tagesspiegel.de/images/15385774/alternates/BASE_16_9_W1400/1774104315000/lawinenungluck-in-sudtirol.jpeg,,In Südtirol sind mehrere Skifahrer von einer großen Lawine erfasst worden. Nach Angaben der italienischen Bergwacht löste sich die Lawine in hochalpinem Gelände an der mehr als 2.600 Meter hohen Hohe… [+1626 chars],,"Alpen: Lawine in Südtirol: Mehrere Skifahrer verschüttet. In den italienischen Alpen geht eine Lawine nieder. Die Rettungsdienste sind im Großeinsatz. Noch ist nicht klar, ob es Opfer gibt.",Alps: Avalanche in South Tyrol: Several skiers buried. An avalanche falls in the Italian Alps. The emergency services are on a large scale. It is not yet clear whether there are any victims.,Alpes: Avalanche in Tyrolis australis: complures nautae sepeliuntur. NIVIS in Alpibus Italiae cadit. Subitis officia magna sunt. Nondum liquet an aliquae fuerint victimae.,2026-03-24 05:10:20+00:00
0ea5e75f9ca705898eb264aa511757ef,2026-03-21T14:45:15Z,'Lawine Klimawandel',www.tagesspiegel.de,de,0.9,Alpen: Mindestens zwei Tote durch Lawine in Südtirol,Schon wieder ein Lawinenunglück in den italienischen Alpen: An der Hohen Ferse reißen die Schneemassen mehrere Skifahrer mit. Nach einem Vermissten wird noch gesucht.,https://www.tagesspiegel.de/gesellschaft/panorama/alpen-mindestens-zwei-tote-durch-lawine-in-sudtirol-15385775.html,https://www.tagesspiegel.de/images/15385774/alternates/BASE_16_9_W1400/1774104315000/lawinenungluck-in-sudtirol.jpeg,,Bei einem Lawinenunglück in Südtirol sind mindestens zwei Skifahrer ums Leben gekommen. Nach Angaben der italienischen Bergwacht wurden eine Gruppe von etwa zehn Tourengehern an der 2.669 Meter hohen… [+1885 chars],,Alpen: Mindestens zwei Tote durch Lawine in Südtirol. Schon wieder ein Lawinenunglück in den italienischen Alpen: An der Hohen Ferse reißen die Schneemassen mehrere Skifahrer mit. Nach einem Vermissten wird noch gesucht.,Alps: At least two dead from avalanche in South Tyrol. Another avalanche disaster in the Italian Alps: the masses of snow swept away several skiers on the Hohe Ferse. A missing person is still being searched for.,Alpes: Saltem duo mortui ab avalanche in Tyrol Australi. Alia NIVIS CASUS in Alpibus Italicis: massae nivis complures nautas in Hohe Ferse rapuerunt. A absentis homo adhuc quaerebatur.,2026-03-24 05:10:20+00:00
e4eb16d826e7c87e058792130c2e1be3,2026-03-21T14:48:00Z,'Lawine',www.focus.de,de,0.9,Lawine verschüttet Skifahrer – Großeinsatz in Südtirol,In Südtirol sind mehrere Skifahrer von einer großen Lawine erfasst worden.,https://www.focus.de/panorama/welt/lawine-verschuettet-skifahrer-grosseinsatz-in-suedtirol_fc0e645a-bb17-4a0c-8f64-bc7e1f6f3ab3.html,"https://quadro.burda-forward.de/ctf/4734f197-4a08-4817-8168-9a43e3952dbf.1ac6bc3e-808f-427d-9a18-43dd4ba52d1e.jpeg?im=RegionOfInterestCrop=(1200,630),regionOfInterest=(1024,668)&hash=495e76febec894d809a5fe2ba905819db0579ece3928a8cfe3f375df63e3c640",,"Nach Angaben der italienischen Bergwacht löste sich die Lawine in hochalpinem Gelände an der mehr als 2.600 Meter hohen Hohen Ferse nahe Ratschings. Befürchtet wird, dass unter den Schneemassen bis z… [+1497 chars]",,Lawine verschüttet Skifahrer – Großeinsatz in Südtirol. In Südtirol sind mehrere Skifahrer von einer großen Lawine erfasst worden.,Avalanche buries skiers – major operation in South Tyrol. Several skiers were hit by a large avalanche in South Tyrol.,Avalanche sepelit nartatores – maioris operationis in Tyrol Australi. Complures nartatores ab magna NIVIS in Tyrolis Meridianis percussi sunt.,2026-03-24 05:10:20+00:00
23322872768834ffbe23abbd659f379d,2026-03-21T14:58:10Z,'Schneemassen',www.stern.de,de,0.9,Alpen: Mindestens zwei Tote durch Lawine in Südtirol,Schon wieder ein Lawinenunglück in den italienischen Alpen: An der Hohen Ferse reißen die Schneemassen mehrere Skifahrer mit. Nach einem Vermissten wird noch gesucht.,https://www.stern.de/panorama/alpen--mindestens-zwei-tote-durch-lawine-in-suedtirol-37242652.html,https://image.stern.de/37242654/t/KZ/v2/w1440/r1.7778/-/21--f2qlko3wavv6axs2048jpeg---fa23d95d96496879.jpg,,"Kopiere den aktuellen Link
Zur Merkliste hinzufügen
Schon wieder ein Lawinenunglück in den italienischen Alpen: An der Hohen Ferse reißen die Schneemassen mehrere Skifahrer mit. Nach einem Vermisst… [+2013 chars]",,Alpen: Mindestens zwei Tote durch Lawine in Südtirol. Schon wieder ein Lawinenunglück in den italienischen Alpen: An der Hohen Ferse reißen die Schneemassen mehrere Skifahrer mit. Nach einem Vermissten wird noch gesucht.,Alps: At least two dead from avalanche in South Tyrol. Another avalanche disaster in the Italian Alps: the masses of snow swept away several skiers on the Hohe Ferse. A missing person is still being searched for.,Alpes: Saltem duo mortui ab avalanche in Tyrol Australi. Alia NIVIS CASUS in Alpibus Italicis: massae nivis complures nautas in Hohe Ferse rapuerunt. A absentis homo adhuc quaerebatur.,2026-03-24 05:10:20+00:00
0a99adb3b5c7a74824dfc048093aba88,2026-03-21T15:12:00Z,'Lawine',www.stern.de,de,0.9,Ratsching: Mehrere Skifahrer von Lawine in Südtirol verschüttet,Großeinsatz der italienischen Bergwacht: In Südtirol sind offenbar mehrere Alpinisten von einer Lawine verschüttet worden. Laut Medienberichten soll es Todesfälle gegeben haben.,https://www.stern.de/panorama/suedtirol--mehrere-skifahrer-von-lawine-verschuettet-37242656.html,https://image.stern.de/37242664/t/ie/v1/w1440/r1.7778/-/suedtirol-lawine.jpg,,"Kopiere den aktuellen Link
Zur Merkliste hinzufügen
Großeinsatz der italienischen Bergwacht: In Südtirol sind offenbar mehrere Alpinisten von einer Lawine verschüttet worden. Laut Medienberichten s… [+1976 chars]",,Ratsching: Mehrere Skifahrer von Lawine in Südtirol verschüttet. Großeinsatz der italienischen Bergwacht: In Südtirol sind offenbar mehrere Alpinisten von einer Lawine verschüttet worden. Laut Medienberichten soll es Todesfälle gegeben haben.,"Ratsching: Several skiers buried by avalanche in South Tyrol. Large-scale operation by the Italian mountain rescue service: several alpinists were apparently buried by an avalanche in South Tyrol. According to media reports, there are said to have been deaths.",Ratsching: Plures nartatores ab avalanche in Tyrol Australi sepulti sunt. Magnae-scalae operationes per montem Italiae ministerium liberandum: complures alpinistae ab avalanche in Tyrol Australi sepulti videntur. Mortes dicuntur fuisse secundum medias relationes.,2026-03-24 05:10:20+00:00
9c3c35f63081ce1302154ce552c1a589,2026-03-21T15:55:22Z,'Lawine Klimawandel',www.n-tv.de,de,0.9,Schneemassen erfassen Skifahrer: Zwei Tote und fünf Verletzte bei Lawinenunglück in Tirol,Eine Lawine überrascht in Südtirol mehrere Skifahrer. Etwa zehn Personen werden von den Schneemassen mitgerissen. Rettungskräfte zählen fünf Verletzte und zwei Tote.,https://www.n-tv.de/panorama/Zwei-Tote-und-fuenf-Verletzte-bei-Lawinenunglueck-in-Tirol-id30496597.html,https://www.n-tv.de/img/30496598/1774111187/Img_16_9/1200/Rettungsdienste-suchen-an-der-Hohen-Ferse-in-den-Stubaier-Alpen-In-Suedtirol-sind-mehrere-Skifahrer-von-einer-grossen-Lawine-erfasst-worden-Nach-Angaben-der-italienischen-Bergwacht-loeste-sich-die-Lawine-in-hochalpinem-Gelaende-an-der-mehr-als-2-600-Meter-hohen-Hohen-Ferse-nahe-Ratschings.jpg,,"Rettungskräfte suchen an der Hohen Ferse nach Verschütteten. (Foto: picture alliance/dpa/Italienische Bergwacht)
Eine Lawine überrascht in Südtirol mehrere Skifahrer. Etwa zehn Personen werden von d… [+2689 chars]",,Schneemassen erfassen Skifahrer: Zwei Tote und fünf Verletzte bei Lawinenunglück in Tirol. Eine Lawine überrascht in Südtirol mehrere Skifahrer. Etwa zehn Personen werden von den Schneemassen mitgerissen. Rettungskräfte zählen fünf Verletzte und zwei Tote.,Snow masses capture skiers: two dead and five injured in avalanche accident in Tyrol. An avalanche surprises several skiers in South Tyrol. About ten people are swept away by the masses of snow. Rescue workers count five injured and two dead.,Nives massae nautas capiunt: duo mortui et quinque casus in Raetis vulnerati sunt in NIVIS. NIVIS CASUS aliquot nautas in Raetis Meridionalis opprimit. Circiter decem homines massas nivis rapiuntur. Operarios libera quinque laesi et duos mortuos numera.,2026-03-24 05:10:20+00:00
1b4a9b20eaf24e756f8e6c79d3dcfb06,2026-03-21T16:12:37Z,'Lawine Klimawandel',tirol.orf.at,de,0.9,Zwei Tote durch Lawine in Südtirol,"Zu einem tragischen Lawinenunglück ist es am Samstag im Südtiroler Ridnaun gekommen. Zwei Menschen kamen ums Leben, außerdem gab es fünf Verletzte. Drei von ihnen befanden sich in kritischem Zustand. Mehrere Personen waren verschüttet worden.",https://tirol.orf.at/stories/3346837/,https://ibs.orf.at/tir?image=https%3A%2F%2Foekastatic.orf.at%2Fmims%2F2019%2F36%2F66%2Fcrops%2Fw%3D1200%2Ch%3D627%2Cq%3D75%2F283496_master_86766_hub.jpg%3Fs%3D5b31cc283bcd45320883e38ab377e6d00fcf7ab1,http://web.archive.org/web/20260321162046/https://tirol.orf.at/stories/3346837/,"Die Lawine ging gegen 11.40 Uhr an der Rudererspitze auf etwa 2.445 Metern oberhalb der Gewinges Alm ab, wie der Südtiroler Gesundheitsbetrieb meldete.
Mehrere Skitouren-Gruppen waren unterwegs. Ins… [+1434 chars]",,"Zwei Tote durch Lawine in Südtirol. Zu einem tragischen Lawinenunglück ist es am Samstag im Südtiroler Ridnaun gekommen. Zwei Menschen kamen ums Leben, außerdem gab es fünf Verletzte. Drei von ihnen befanden sich in kritischem Zustand. Mehrere Personen waren verschüttet worden.","Two dead in avalanche in South Tyrol. A tragic avalanche accident occurred on Saturday in Ridnaun, South Tyrol. Two people were killed and five were injured. Three of them were in critical condition. Several people were buried.","Duo mortui sunt in Avalanche in Tyrol Australi. Casus NIVIS tragici Saturni die in Ridnaun, Meridionali Tyrol accidit. Duo homines interfecti et quinque vulnerati sunt. Tres ex his in discrimine versae sunt. Plures sepeliebantur.",2026-03-24 05:10:20+00:00
