index,published,keyword,domain,language,valid,title,description,url,image,archive,content,quote,de,en,la,added
18ee20ef0575144239eeef06d74481ae,2026-03-01T12:43:00Z,'Lawine',www.zeit.de,de,0.9,Berchtesgadener Alpen: Schneeschuhwanderer lösen Lawine aus und werden verschüttet,Hier finden Sie Informationen zu dem Thema „Berchtesgadener Alpen“. Lesen Sie jetzt „Schneeschuhwanderer lösen Lawine aus und werden verschüttet“.,https://www.zeit.de/news/2026-03/01/schneeschuhwanderer-loesen-lawine-aus-und-werden-verschuettet,https://img.zeit.de/news/2026-03/01/schneeschuhwanderer-loesen-lawine-aus-und-werden-verschuettet-image-group/wide__1300x731,http://web.archive.org/web/20260301130419/https://www.zeit.de/news/2026-03/01/schneeschuhwanderer-loesen-lawine-aus-und-werden-verschuettet,Schneeschuhwanderer haben in den Berchtesgadener Alpen eine Lawine ausgelöst und sind davon mitgerissen worden. Laut Polizei wurde nur einer von ihnen leicht verletzt. Die Gruppe sei ohne alpine Erfa… [+1197 chars],,Berchtesgadener Alpen: Schneeschuhwanderer lösen Lawine aus und werden verschüttet. Hier finden Sie Informationen zu dem Thema „Berchtesgadener Alpen“. Lesen Sie jetzt „Schneeschuhwanderer lösen Lawine aus und werden verschüttet“.,Berchtesgaden Alps: Snowshoe hikers trigger an avalanche and are buried. Here you will find information on the topic “Berchtesgaden Alps”. Now read “Snowshoers trigger an avalanche and are buried”.,"Alpes Berchtesgaden: Snowshoe hikers felis avalanche et asservatur. Hic informationes invenies in themate ""Berchtesgaden Alpes"". Nunc lege ""Nives NIVIS CAELI ac sepeliuntur"".",2026-03-03 09:06:23+00:00
7a265089a273ef9fb842f536a9fbd384,2026-03-01T12:43:00Z,'Lawine',www.stern.de,de,0.9,Berchtesgadener Alpen: Schneeschuhwanderer lösen Lawine aus und werden verschüttet,"Ohne alpine Erfahrung und Schutzausrüstung unterwegs: Eine Gruppe Schneeschuhwanderer löst eine Lawine aus und wird mitgerissen. Die Polizei spricht von ""Glück"" für die Beteiligten.",https://www.stern.de/gesellschaft/regional/bayern/berchtesgadener-alpen--schneeschuhwanderer-loesen-lawine-aus-und-werden-verschuettet-37181152.html,https://image.stern.de/37181154/t/ae/v1/w1440/r1.7778/-/01--rgm6ovrqulv15axs2048jpeg---8d08b3b8f3972c6e.jpg,,"Kopiere den aktuellen Link
Zur Merkliste hinzufügen
Ohne alpine Erfahrung und Schutzausrüstung unterwegs: Eine Gruppe Schneeschuhwanderer löst eine Lawine aus und wird mitgerissen. Die Polizei spri… [+1394 chars]",,"Berchtesgadener Alpen: Schneeschuhwanderer lösen Lawine aus und werden verschüttet. Ohne alpine Erfahrung und Schutzausrüstung unterwegs: Eine Gruppe Schneeschuhwanderer löst eine Lawine aus und wird mitgerissen. Die Polizei spricht von ""Glück"" für die Beteiligten.",Berchtesgaden Alps: Snowshoe hikers trigger an avalanche and are buried. On the move without alpine experience or protective equipment: a group of snowshoe hikers trigger an avalanche and are swept away. The police speak of “luck” for those involved.,"Alpes Berchtesgaden: Snowshoe hikers felis avalanche et asservatur. In motu sine experientia alpina vel armorum tutela: globus nivis hikers felis NIVIS et rapitur. Magistratus loquuntur de ""fortuna"" pro illis qui intersunt.",2026-03-03 09:06:23+00:00
043206ccff7b2a3c06c7bd01f79292c7,2026-03-01T17:36:33Z,'Lawinenkegel',www.diepresse.com,de,0.9,Zwei Skitourengeher bei Lawinenabgang in Tirol ums Leben gekommen,Die Leichen der beiden Einheimischen wurden am Sonntag im Rahmen einer groß angelegten Suchaktion in einem Lawinenkegel in den Tuxer Alpen gefunden.,https://www.diepresse.com/20638305/zwei-skitourengeher-bei-lawinenabgang-in-tirol-ums-leben-gekommen,https://img.diepresse.com/public/incoming/g5qiqw-kein-titel/alternates/DPR_SOCIAL_NACHRICHTEN/kein%20Titel,,"Die Leichen der beiden Einheimischen wurden am Sonntag im Rahmen einer groß angelegten Suchaktion in einem Lawinenkegel in den Tuxer Alpen gefunden.
Zwei Skitourengeher im Alter von 44 und 47 Jahren… [+1618 chars]",,Zwei Skitourengeher bei Lawinenabgang in Tirol ums Leben gekommen. Die Leichen der beiden Einheimischen wurden am Sonntag im Rahmen einer groß angelegten Suchaktion in einem Lawinenkegel in den Tuxer Alpen gefunden.,Two ski tourers died in an avalanche in Tyrol. The bodies of the two locals were found on Sunday as part of a large-scale search operation in an avalanche cone in the Tux Alps.,Duae ski Tourers in monte Raetici mortuus est. Corpora duorum incolis die Dominico inventa sunt ut pars operationis magnae inquisitionis in cono NIVIS in Alpibus Tux.,2026-03-08 20:47:49+00:00
c0e116ba96cef812348d3972a91eff68,2026-03-09T15:24:46Z,'Lawine',www.zeit.de,de,0.9,Österreich: Deutscher Schneeschuh-Wanderer in Tirol von Lawine getötet,Hier finden Sie Informationen zu dem Thema „Österreich“. Lesen Sie jetzt „Deutscher Schneeschuh-Wanderer in Tirol von Lawine getötet“.,https://www.zeit.de/news/2026-03/09/deutscher-schneeschuh-wanderer-in-tirol-von-lawine-getoetet,https://img.zeit.de/news/2026-03/09/deutscher-schneeschuh-wanderer-in-tirol-von-lawine-getoetet-image-group/wide__1300x731,,Ein Wintersportler aus dem Raum Stuttgart ist in den Tiroler Bergen Hunderte Meter von einer Lawine mitgerissen und getötet worden. Das teilte die österreichische Polizei am Montag mit. Demnach alarm… [+899 chars],,Österreich: Deutscher Schneeschuh-Wanderer in Tirol von Lawine getötet. Hier finden Sie Informationen zu dem Thema „Österreich“. Lesen Sie jetzt „Deutscher Schneeschuh-Wanderer in Tirol von Lawine getötet“.,Austria: German snowshoe hiker killed by avalanche in Tyrol. Here you will find information on the topic of “Austria”. Now read “German snowshoe hiker killed by avalanche in Tyrol”.,"Austria: German snowshoe hiker occisus ab Avalanche in Tyrol. Hic informationes invenies in argumento ""Austriae"". Nunc legitur ""Germanicus snowshoe hiker occisus ab NIVIS in Tyrol"".",2026-03-11 15:11:23+00:00
c7bd994fd8ff74242ebcbbeb129d2b29,2026-03-05T19:32:10Z,'Erwärmung Lawinen',www.tagesschau.de,de,0.2,Waldschäden könnten sich bis zum Jahr 2100 verdoppeln,"Modellrechnungen der TU München zeigen, dass Brände und Schädlingsbefall in Europas Wäldern bis 2100 stark zunehmen könnten. Je nach Temperaturanstieg würde es Wälder wie heute dann vielleicht nicht mehr geben. Von Andreas Kegel.",https://www.tagesschau.de/wissen/klima/klimawandel-wald-kohlenstoff-100.html,https://images.tagesschau.de/image/f5709e5f-d86f-46df-9668-d1cc5c1a2735/AAABnL6cp0o/AAABmyZE0EA/16x9-big/borkenkaefer-fichten-100.jpg?width=1280,,"Stand: 05.03.2026 20:32 Uhr
Modellrechnungen der TU München zeigen, dass Brände und Schädlingsbefall in Europas Wäldern bis 2100 stark zunehmen könnten. Je nach Temperaturanstieg würde es Wälder wie… [+4221 chars]",,"Waldschäden könnten sich bis zum Jahr 2100 verdoppeln. Modellrechnungen der TU München zeigen, dass Brände und Schädlingsbefall in Europas Wäldern bis 2100 stark zunehmen könnten. Je nach Temperaturanstieg würde es Wälder wie heute dann vielleicht nicht mehr geben. Von Andreas Kegel.","Forest damage could double by the year 2100. Model calculations from the Technical University of Munich show that fires and pest infestations in Europe's forests could increase sharply by 2100. Depending on the rise in temperatures, forests like today might no longer exist. By Andreas Kegel.","Damnum silvae ab anno 2100 duplicare potuit. Exemplar calculi ex Universitate Technical Monacensis ostendunt incendia et pestes infestationes in silvis Europaeis acriter augere per 2100. Secundum ortum in temperaturis, silvae sicut hodie amplius non sunt. Apud Andream Kegel.",2026-03-14 14:52:46+00:00
676dfbbc1fad7ea2bfe3101e8f7ba95f,2026-03-01T12:20:00Z,'Lawine',www.stern.de,de,0.9,Unsichtbare Gefahr: Snowbiker löst XXL-Lawine aus – und rast um sein Leben,"Neuschnee in den Bergen Colorados birgt für Wintersportler unsichtbare Gefahren. Ein Motorschlitten-Fahrer löst unbewusst eine Lawine aus, die auf einen zweiten Fahrer zurast.",https://www.stern.de/panorama/usa--snowbiker-loest-xxl-lawine-aus---und-rast-um-sein-leben--video--37180842.html,https://image.stern.de/37181102/t/3O/v1/w1440/r1.7778/-/lawine-snowbiker.jpg,,"Zugang zu stern+statt 11,96 
 nur 1  
<ul><li>Alles von stern+ mit erstklassigen Inhalten von GEO und Capital</li><li>4 Wochen testen, dann 2,99  je Woche</li><li>jederzeit kündbar</li></ul>",,"Unsichtbare Gefahr: Snowbiker löst XXL-Lawine aus – und rast um sein Leben. Neuschnee in den Bergen Colorados birgt für Wintersportler unsichtbare Gefahren. Ein Motorschlitten-Fahrer löst unbewusst eine Lawine aus, die auf einen zweiten Fahrer zurast.",Invisible danger: Snow biker triggers an XXL avalanche - and races for his life. Fresh snow in the mountains of Colorado poses invisible dangers for winter sports enthusiasts. A snowmobile driver unknowingly triggers an avalanche that rushes towards a second driver.,Invisibile periculum: Nivis biker trigger an XXI NIVIS - et cursus vitae eius. Nix nova in montibus Colorado invisibilia pericula pro ludis hiemalibus ponit fanaticus. A snowmobile coegi saltem NIVIS qui nesciens ad alterum coegi ruit.,2026-03-15 14:54:27+00:00
fdfdceb4a71d3e36c03cb1ef304b012f,2026-03-01T15:02:11Z,'Lawine',www.sueddeutsche.de,de,0.9,Schönau am Königssee: Lawine reißt Schneeschuhgeher mit,"In den Berchtesgadener Alpen lösten unerfahrene Schneeschuhwanderer eine Lawine aus. Nur ein Teilnehmer wurde leicht verletzt. Die Bergwacht suchte nach weiteren Verschütteten, fand jedoch niemanden.",https://www.sueddeutsche.de/bayern/lawine-schneeschuhwanderer-schoenau-koenigssee-li.3396323,https://www.sueddeutsche.de/2026/03/01/9dfb9b49-2175-4279-903b-dc3d564c68e6.jpg?q=60&fm=webp&width=1200&rect=0%2C209%2C4000%2C2250,http://web.archive.org/web/20260301192948/https://www.sueddeutsche.de/bayern/lawine-schneeschuhwanderer-schoenau-koenigssee-li.3396323,"Als die Einsatzkräfte am Samstag alarmiert wurden, war zunächst unklar, wie viele Personen von der Lawine verschüttet wurden. Zwei Einsatzkräfte der Bergwacht wurden mit dem Rettungshubschrauber in d… [+999 chars]",,"Schönau am Königssee: Lawine reißt Schneeschuhgeher mit. In den Berchtesgadener Alpen lösten unerfahrene Schneeschuhwanderer eine Lawine aus. Nur ein Teilnehmer wurde leicht verletzt. Die Bergwacht suchte nach weiteren Verschütteten, fand jedoch niemanden.","Schönau am Königssee: Avalanche sweeps snowshoe walkers away. Inexperienced snowshoe hikers triggered an avalanche in the Berchtesgaden Alps. Only one participant was slightly injured. The mountain rescue service looked for other buried people, but found no one.","Schönau am Königssee: Avalanche scopa nivis ambulatores aufert. Imperitus snowshoe hikers utitur NIVIS in Alpibus Berchtesgaden. Unus tantum particeps leviter vulneratus est. Mons opem servans quaesivit alios homines sepultos, sed neminem invenit.",2026-03-15 14:54:27+00:00
829119f9f758dd9dd4ee5d48dd86f5ae,2026-03-04T18:36:43Z,'Lawine',kaernten.orf.at,de,0.9,Lawinenhundeübung in der Innerkrems,"In der Innerkrems sind seit Freitag Teams der Kärntner Bergrettung bei einer großangelegten Lawinenhundeübung im Einsatz. Auch Gruppen aus der Slowakei, Italien und Deutschland lassen sich diesen Intensivkurs nicht entgehen. Es geht dabei vor allem auch um di…",https://kaernten.orf.at/stories/3344444/,https://ibs.orf.at/ktn?image=https%3A%2F%2Foekastatic.orf.at%2Fmims%2F2026%2F10%2F52%2Fcrops%2Fw%3D1200%2Ch%3D627%2Cq%3D75%2F2957637_master_1143452_20260304_lawinenhundekurs_innerkrems_cf_00_00_12_17.jpg%3Fs%3D42a1b7b53b6bd3c835ada4e3a56f277980f57d15,,"Der dreijährige Berner-Sennen-Labrador- Mischling Sylva übte mit Bergretter Kai Broschek einen Verschütteten in einem Lawinenkegel zu finden. Dabei werde nichts mit Druck gemacht, sagte Broschek: Wir… [+1739 chars]",,"Lawinenhundeübung in der Innerkrems. In der Innerkrems sind seit Freitag Teams der Kärntner Bergrettung bei einer großangelegten Lawinenhundeübung im Einsatz. Auch Gruppen aus der Slowakei, Italien und Deutschland lassen sich diesen Intensivkurs nicht entgehen. Es geht dabei vor allem auch um di…","Avalanche dog training in the Innerkrems. Carinthian mountain rescue teams have been working on a large-scale avalanche dog exercise in the Innerkrems since Friday. Groups from Slovakia, Italy and Germany also don't miss this intensive course. Above all, it’s about…","Exercitatio canis NIVIS in Innerkrems. Mons Carinthius iunctos liberandi laboravit in magna-scala avalanche canis exercitatio in Innerkrems post Veneris. Sodalitates ex Slovakia, Italia et Germania etiam hunc intensivum cursum non requirunt. Ante omnia est de…",2026-03-15 14:54:27+00:00
ddb3dec6323f00cf72e0da26465a59ee,2026-03-08T13:13:45Z,'Lawine',www.diepresse.com,de,0.9,Eine Person bei Lawinenunfall in Tirol getötet,Eine verschüttete Person konnte nach einem Lawinenabgang im Bereich des Serleskamm bei Neustift im Stubaital nur noch tot geborgen werden. Angaben zur Identität des Opfers lagen vorerst nicht vor.,https://www.diepresse.com/20657879/eine-person-bei-lawinenunfall-in-tirol-getoetet,https://www.diepresse.com/assets_v2/images/diepresse_nachrichten.png,,"Eine verschüttete Person konnte nach einem Lawinenabgang im Bereich des Serleskamm bei Neustift im Stubaital nur noch tot geborgen werden. Angaben zur Identität des Opfers lagen vorerst nicht vor.
 … [+1175 chars]",,Eine Person bei Lawinenunfall in Tirol getötet. Eine verschüttete Person konnte nach einem Lawinenabgang im Bereich des Serleskamm bei Neustift im Stubaital nur noch tot geborgen werden. Angaben zur Identität des Opfers lagen vorerst nicht vor.,One person killed in avalanche accident in Tyrol. A buried person could only be rescued dead after an avalanche in the Serleskamm area near Neustift in the Stubaital. Information about the identity of the victim was not immediately available.,Unus homo in Raetico casus in NIVIS CASUS occisus. Homo sepultus solum liberari potuit mortuum post montem cadentem in area Serleskamm prope Neustift in Stubaital. Informationes de identitate victimae statim praesto non erat.,2026-03-15 14:54:27+00:00
2c42546eab95a89833e50085f633eee6,2026-03-08T16:15:53Z,'Lawine',salzburg.orf.at,de,0.9,Lawinenabgang: 22 Bergretter bei Sucheinsatz,In den Nockbergen (Lungau) hat es im Bereich des Schilchernocks am Sonntag einen Lawinenabgang gegeben. Skitourengeher hatten einen größeren Abgang bemerkt und immer wieder Signale mit ihrem Lawinenverschütteten-Gerät empfangen.,https://salzburg.orf.at/stories/3344949/,https://ibs.orf.at/sbg?image=https%3A%2F%2Foekastatic.orf.at%2Fmims%2F2026%2F11%2F74%2Fcrops%2Fw%3D1200%2Ch%3D627%2Cq%3D75%2F2961898_master_1145174_img-20260308-wa0035.jpg%3Fs%3Dd5c129d0b83b5701bee50b8fcc75228332eef9c6,http://web.archive.org/web/20260309014440/https://salzburg.orf.at/stories/3344949/,Auf dem Schneebrett lag außerdem eine Skibrille. In dem etwa 200 Meter breiten Lawinenkegel mit einer Länge von rund 80 Metern wurden auch Einfahrtsspuren entdeckt. Die Bergrettungsortsstellen Tamswe… [+1021 chars],,Lawinenabgang: 22 Bergretter bei Sucheinsatz. In den Nockbergen (Lungau) hat es im Bereich des Schilchernocks am Sonntag einen Lawinenabgang gegeben. Skitourengeher hatten einen größeren Abgang bemerkt und immer wieder Signale mit ihrem Lawinenverschütteten-Gerät empfangen.,Avalanche: 22 mountain rescuers on search mission. In the Nockberge (Lungau) there was an avalanche in the Schilchernock area on Sunday. Ski tourers had noticed a major fall and kept receiving signals with their avalanche device.,Avalanche: Salvatores montis 22 in inquisitione missionis. In Nockberge (Lungau) erat avalanche in Schilchernock area die Dominico. Ski Tourers maiorem ruinam animadverterant et signa accipientes cum fabrica NIVIS CAELIBANT.,2026-03-15 14:54:27+00:00
337c1fadedc45c9417390a6329f31d67,2026-03-09T05:37:40Z,'Lawine',tirol.orf.at,de,0.9,Zwei Tourengeher von Lawine erfasst,Sonntagnachmittag sind zwei Tourengeher in Galtür (Bezirk Landeck) von einer Lawine erfasst worden. Dabei kam ein 57-Jähriger zu Sturz und verletzte sich am Ellenbogen. Er wurde mit dem Hubschrauber in das Krankenhaus Zams geflogen.,https://tirol.orf.at/stories/3344972/,https://ibs.orf.at/tir?image=https%3A%2F%2Foekastatic.orf.at%2Fmims%2F2022%2F48%2F30%2Fcrops%2Fw%3D1200%2Ch%3D627%2Cq%3D75%2F1584888_master_580230_jhemenbild_tourengeher_._.jpg%3Fs%3D990f39d99a993516c64b5ca25063b36f05c8ac34,,"Die fünfköpfige Gruppe aus Spanien startete am frühen Nachmittag ihre Skitour im Jamtalgebiet. Ihr Ziel war die 2.400 hoch gelegene Jamtalhütte.
Während der Abfahrt über das Totenfeld löste sich kur… [+429 chars]",,Zwei Tourengeher von Lawine erfasst. Sonntagnachmittag sind zwei Tourengeher in Galtür (Bezirk Landeck) von einer Lawine erfasst worden. Dabei kam ein 57-Jähriger zu Sturz und verletzte sich am Ellenbogen. Er wurde mit dem Hubschrauber in das Krankenhaus Zams geflogen.,"Two ski tourers hit by an avalanche. On Sunday afternoon, two ski tourers were hit by an avalanche in Galtür (Landeck district). A 57-year-old fell and injured his elbow. He was flown by helicopter to Zams Hospital.",Duo ski Tourers ictus NIVIS. Die Dominico post meridiem duo ski Tourers ab avalanche in Galtür (regio Landeck). A 57 annos cecidit et cubitum vulneravit. ab helicopter ad hospitale Zams volavit.,2026-03-15 14:54:27+00:00
2685fc0ab40c1cd85acd3815ae66d36b,2026-03-09T15:24:46Z,'Lawine',www.stern.de,de,0.9,Österreich: Deutscher Schneeschuh-Wanderer in Tirol von Lawine getötet,Etwa 400 Meter stürzt ein Schneeschuh-Wanderer im Stubaital mit einer Lawine in die Tiefe. Seine Begleiter schlagen sofort Alarm. Trotz Suchgerät und Notarzt kommt jede Hilfe zu spät.,https://www.stern.de/panorama/oesterreich--deutscher-schneeschuh-wanderer-in-tirol-von-lawine-getoetet-37205694.html,https://image.stern.de/37205696/t/ZS/v1/w1440/r1.7778/-/09--rwa7jvxsuev10axs2048jpeg---4637f0af77d06ae6.jpg,http://web.archive.org/web/20260310083048/https://www.stern.de/panorama/oesterreich--deutscher-schneeschuh-wanderer-in-tirol-von-lawine-getoetet-37205694.html,"Kopiere den aktuellen Link
Zur Merkliste hinzufügen
Etwa 400 Meter stürzt ein Schneeschuh-Wanderer im Stubaital mit einer Lawine in die Tiefe. Seine Begleiter schlagen sofort Alarm. Trotz Suchgerät… [+1098 chars]",,Österreich: Deutscher Schneeschuh-Wanderer in Tirol von Lawine getötet. Etwa 400 Meter stürzt ein Schneeschuh-Wanderer im Stubaital mit einer Lawine in die Tiefe. Seine Begleiter schlagen sofort Alarm. Trotz Suchgerät und Notarzt kommt jede Hilfe zu spät.,"Austria: German snowshoe hiker killed by avalanche in Tyrol. A snowshoe hiker falls about 400 meters in an avalanche in the Stubaital. His companions immediately raised the alarm. Despite the search device and the emergency doctor, any help comes too late.","Austria: German snowshoe hiker occisus ab Avalanche in Tyrol. A snowshoe hiker de 400 metris in montem cadentem in Stubaital cadit. Sociis statim terrorem iniecit. Quamvis machinam quaerendi et subitis medici, quodlibet auxilium sero venit.",2026-03-15 14:54:27+00:00
95bbecae074ba02a7e85dbab25353bc4,2026-03-09T15:25:59Z,'Lawine',www.tagesspiegel.de,de,0.9,Österreich: Deutscher Schneeschuh-Wanderer in Tirol von Lawine getötet,Etwa 400 Meter stürzt ein Schneeschuh-Wanderer im Stubaital mit einer Lawine in die Tiefe. Seine Begleiter schlagen sofort Alarm. Trotz Suchgerät und Notarzt kommt jede Hilfe zu spät.,https://www.tagesspiegel.de/gesellschaft/panorama/osterreich-deutscher-schneeschuh-wanderer-in-tirol-von-lawine-getotet-15334554.html,https://www.tagesspiegel.de/images/15334553/alternates/BASE_16_9_W1400/1773069959000/schneeschuh-wandern.jpeg,http://web.archive.org/web/20260310021611/https://www.tagesspiegel.de/gesellschaft/panorama/osterreich-deutscher-schneeschuh-wanderer-in-tirol-von-lawine-getotet-15334554.html,Ein Wintersportler aus dem Raum Stuttgart ist in den Tiroler Bergen Hunderte Meter von einer Lawine mitgerissen und getötet worden. Das teilte die österreichische Polizei am Montag mit. Demnach alarm… [+953 chars],,Österreich: Deutscher Schneeschuh-Wanderer in Tirol von Lawine getötet. Etwa 400 Meter stürzt ein Schneeschuh-Wanderer im Stubaital mit einer Lawine in die Tiefe. Seine Begleiter schlagen sofort Alarm. Trotz Suchgerät und Notarzt kommt jede Hilfe zu spät.,"Austria: German snowshoe hiker killed by avalanche in Tyrol. A snowshoe hiker falls about 400 meters in an avalanche in the Stubaital. His companions immediately raised the alarm. Despite the search device and the emergency doctor, any help comes too late.","Austria: German snowshoe hiker occisus ab Avalanche in Tyrol. A snowshoe hiker de 400 metris in montem cadentem in Stubaital cadit. Sociis statim terrorem iniecit. Quamvis machinam quaerendi et subitis medici, quodlibet auxilium sero venit.",2026-03-15 14:54:27+00:00
cc853e6d97cc3576379ba7bbd71d9f78,2026-03-09T15:35:00Z,'Lawine',www.focus.de,de,0.9,400-Meter-Sturz: Deutscher Schneeschuh-Wanderer von Lawine in Tirol getötet,Etwa 400 Meter stürzt ein Schneeschuh-Wanderer im Stubaital mit einer Lawine in die Tiefe. Seine Begleiter schlagen sofort Alarm. Trotz Suchgerät und Notarzt kommt jede Hilfe zu spät.,https://www.focus.de/panorama/welt/400-meter-sturz-deutscher-schneeschuh-wanderer-von-lawine-in-tirol-getoetet_ece11d5c-5d15-486e-bf54-d661cd7bed2d.html,https://quadro.burda-forward.de/ctf/f8c85444-b735-4ca7-a26f-ee2490dfa163.166b003b-47bc-4c7a-9925-9dbc249f32e7.jpeg?im=RegionOfInterestCrop%3D%281200%2C630%29%2CregionOfInterest%3D%281024%2C683%29&hash=cd6b87a3b2a47cc72d9ed470cc477136e74053894f735df7897078d2448b8d50,,"Das teilte die österreichische Polizei am Montag mit. Demnach alarmierten zwei Begleiter des Mannes sofort die Rettungskräfte, doch der 59-jährige Schneeschuh-Wanderer aus dem Raum Stuttgart konnte n… [+754 chars]",,400-Meter-Sturz: Deutscher Schneeschuh-Wanderer von Lawine in Tirol getötet. Etwa 400 Meter stürzt ein Schneeschuh-Wanderer im Stubaital mit einer Lawine in die Tiefe. Seine Begleiter schlagen sofort Alarm. Trotz Suchgerät und Notarzt kommt jede Hilfe zu spät.,"400-meter fall: German snowshoe hiker killed by avalanche in Tyrol. A snowshoe hiker falls about 400 meters in an avalanche in the Stubaital. His companions immediately raised the alarm. Despite the search device and the emergency doctor, any help comes too late.","400 metrum cadunt: German snowshoe hiker occisus ab avalanche in Tyrol. A snowshoe hiker de 400 metris in montem cadentem in Stubaital cadit. Sociis statim terrorem iniecit. Quamvis machinam quaerendi et subitis medici, quodlibet auxilium sero venit.",2026-03-15 14:54:27+00:00
0fa86d84342c10280d61095d15f96b67,2026-03-09T16:17:25Z,'Lawine',www.bild.de,de,0.9,In Tirol - Deutscher Schneeschuh-Wanderer von Lawine getötet,Ein Schneeschuh-Wanderer aus dem Raum Stuttgart ist in den Tiroler Bergen hunderte Meter von einer Lawine mitgerissen und getötet worden.,https://www.bild.de/news/ausland/lawine-in-tirol-deutscher-wintersportler-mitgerissen-und-getoetet-69aee707234864f234f02c17,"https://images.bild.de/69aee707234864f234f02c17/ca94f1001f4d535c62322566a5866be7,428065c0?w=1280",http://web.archive.org/web/20260309163008/https://www.bild.de/news/ausland/lawine-in-tirol-deutscher-wintersportler-mitgerissen-und-getoetet-69aee707234864f234f02c17,TTS-Player überspringenArtikel weiterlesenNeustift (Österreich) Tragödie in den Tiroler Alpen. Ein Wintersportler aus dem Raum Stuttgart ist hunderte Meter von einer Lawine mitgerissen und getötet wo… [+1326 chars],,In Tirol - Deutscher Schneeschuh-Wanderer von Lawine getötet. Ein Schneeschuh-Wanderer aus dem Raum Stuttgart ist in den Tiroler Bergen hunderte Meter von einer Lawine mitgerissen und getötet worden.,In Tyrol - German snowshoe hiker killed by avalanche. A snowshoe hiker from the Stuttgart area was swept away hundreds of meters by an avalanche in the Tyrolean mountains and killed.,In Tyrolis - German snowshoe hiker occisus est ab NIVIS. A snowshoe hiker e area Stuttgart centena metrorum ab avalanche in montibus Tyrolis et occisa est.,2026-03-15 14:54:27+00:00
be32e55331edd6e33ee8c30acfc23a55,2026-03-11T18:03:02Z,'Lawine',www.morgenpost.de,de,0.9,"Tödlicher Urlaub in den Alpen: „War besonders leicht, Lawinen auszulösen“","In den Bergen häufen sich tödliche Lawinenunglücke. Ein Lawinenforscher erklärt, warum die Gefahr im Winter 2025/26 besonders groß ist.",https://www.morgenpost.de/panorama/article411419528/toedlicher-urlaub-in-den-alpen-war-besonders-leicht-lawinen-auszuloesen.html,https://img.sparknews.funkemedien.de/411421966/411421966_1773252181_v16_9_1600.jpeg,http://web.archive.org/web/20260313032357/https://www.morgenpost.de/panorama/article411419528/toedlicher-urlaub-in-den-alpen-war-besonders-leicht-lawinen-auszuloesen.html,Erst am vergangenen Montag meldet die Alpinpolizei in Tirol ein weiteres tragisches Unglück: Eine Lawine in den Tiroler Bergen reißt einen Wintersportler aus Deutschland Hunderte Meter mit sich und b… [+5036 chars],,"Tödlicher Urlaub in den Alpen: „War besonders leicht, Lawinen auszulösen“. In den Bergen häufen sich tödliche Lawinenunglücke. Ein Lawinenforscher erklärt, warum die Gefahr im Winter 2025/26 besonders groß ist.",Deadly vacation in the Alps: “It was particularly easy to trigger avalanches.” Fatal avalanche accidents are increasing in the mountains. An avalanche researcher explains why the danger is particularly great in the winter of 2025/26.,"Funestae feriae in Alpibus: ""Maxime facile felis avalanches"". Exitiale avalanche accidentia in montibus augentur. Investigator NIVIS CASUS est cur periculum maximum in hieme 2025/26.",2026-03-15 14:54:27+00:00
